{
  "schema_id": "oa://contracts/flight-booking/0.9.0",
  "contract_id": "oa_demo_flight_7312",
  "version": "0.9.0",
  "status": "draft",
  "assurance_level": "decision_sensitive",
  "approved_fields": {
    "domain": "travel.flight",
    "constraints": {
      "origin": "JFK",
      "destination": "LHR",
      "nonstop_required": true,
      "final_total_usd_max": 1000,
      "checked_bags_included": 1,
      "departure_hour_local_min": null
    },
    "preferences": {
      "cabin": "economy",
      "quality_preference": "general"
    },
    "value_policy": {
      "objective": "minimize_effective_cost",
      "include_only_proven_eligible_value": true
    }
  },
  "clarification_policy": {
    "method": "expected_decision_regret",
    "question_cost_usd": 5,
    "expected_regret_usd": 18.40,
    "ask_when": "expected_regret_gt_question_cost"
  },
  "evidence_policy": {
    "required_claims": ["provider_identity", "final_amount", "route", "nonstop", "departure_time", "checked_bag", "membership_value"],
    "allowed_states": ["verified", "pending", "inferred", "unobservable", "mismatch"],
    "untrusted_context_policy": {
      "merchant_free_text": "quarantine",
      "structured_event_fields": "allowlisted",
      "may_change_approved_contract": false
    },
    "retention_policy": {
      "status": "requires_privacy_legal_approval",
      "default_days": null
    },
    "access_policy": {
      "writer_roles": ["outcome_verifier"],
      "reader_roles": ["authorized_servicing", "authorized_audit"],
      "purchasing_agent_write": false
    }
  },
  "observability": {
    "provider_identity": "required",
    "final_amount": "required",
    "route": "required",
    "nonstop": "required",
    "departure_time": "required",
    "checked_bag": "required",
    "membership_value": "eventual"
  },
  "protocol_bindings": [
    {"protocol": "ap2", "adapter_version": "0.3.0-demo"},
    {"protocol": "ucp", "adapter_version": "0.3.0-demo"},
    {"protocol": "acp", "adapter_version": "0.3.0-demo"}
  ],
  "provenance": {
    "hash_algorithm": "sha256",
    "contract_hash": "sha256:0000000000000000000000000000000000000000000000000000000000000000",
    "compiler_version": "outcome-compiler/2.1.0",
    "policy_bundle_version": "assurance-policy/1.2.0",
    "model_role": "language_only"
  }
}
